"Feed_ID","Vehicle_ID","FullRegistration","Colour","FuelType","Year","Mileage","Bodytype","Doors","Make","Model","Variant","EngineSize","Price","PreviousPrice","Transmission","PictureRefs","ServiceHistory","PreviousOwners","Description","FourWheelDrive","Options","Comments","New","Used","Site","Origin","V5","Condition","ExDemo","FranchiseApproved","TradePrice","TradePriceExtra","ServiceHistoryText","Cap_ID"
"AETA27382","AETV59497083","V339GLF","GREEN","Petrol","2000","129000","Saloon","4","JAGUAR","V8 XJ SERIES","XJ8 3.2 Auto","3248","1795","","Auto","http://images.autoexposure.co.uk/AETA27382/AETV59497083_1b.jpg,http://images.autoexposure.co.uk/AETA27382/AETV59497083_2b.jpg,http://images.autoexposure.co.uk/AETA27382/AETV59497083_3b.jpg,http://images.autoexposure.co.uk/AETA27382/AETV59497083_4b.jpg,http://images.autoexposure.co.uk/AETA27382/AETV59497083_5b.jpg","0","4","","0","Insurance Group 16, ABS, Alloy Wheels, Audio Remote Control, Climate Control, Drivers Airbag, Electric Door Mirrors, Electrically Adjustable Drivers Seat, Electrically Adjustable Passenger Seat, Front Electric Windows, Front Fog Lights, Heated Door Mirrors, Immobiliser, Leather Seats, Passenger Airbag, Power Steering, Radio/Cassette, Rear Electric Windows, Remote Central Locking, Side Airbags, Steering Wheel Rake Adjustment, Telephone, Traction Control, Trip Computer. THIS IS A TRADE SALE. THIS VEHICLE DOES NOT HAVE ANY MOT!!!","","0","1","","UK","0","","0","0","1795","","",""
"AETA27382","AETV59655625","DY51VCA","RED","Petrol","2001","69000","Hatchback","3","NISSAN","MICRA","1.0 S","998","995","","Manual","http://images.autoexposure.co.uk/AETA27382/AETV59655625_1b.jpg,http://images.autoexposure.co.uk/AETA27382/AETV59655625_2b.jpg,http://images.autoexposure.co.uk/AETA27382/AETV59655625_3b.jpg,http://images.autoexposure.co.uk/AETA27382/AETV59655625_4b.jpg,http://images.autoexposure.co.uk/AETA27382/AETV59655625_5b.jpg,http://images.autoexposure.co.uk/AETA27382/AETV59655625_6b.jpg,http://images.autoexposure.co.uk/AETA27382/AETV59655625_7b.jpg,http://images.autoexposure.co.uk/AETA27382/AETV59655625_8b.jpg","0","3","","0","Insurance Group 3, Body Coloured Bumpers, Drivers Airbag, Immobiliser, Power Steering, Radio/Cassette, Steering Wheel Rake Adjustment. PG MOT UNTIL 04/14. THIS IS A TRADE SALE!!!","","0","1","","UK","0","","0","0","995","","",""
"AETA27382","AETV60978280","BN57UXF","Waterfall green","Petrol","2007","36000","Hatchback","5","NISSAN","MICRA","1.2 Chic","1240","5495","","Manual","http://images.autoexposure.co.uk/AETA27382/AETV60978280_1b.jpg,http://images.autoexposure.co.uk/AETA27382/AETV60978280_2b.jpg,http://images.autoexposure.co.uk/AETA27382/AETV60978280_3b.jpg,http://images.autoexposure.co.uk/AETA27382/AETV60978280_4b.jpg,http://images.autoexposure.co.uk/AETA27382/AETV60978280_5b.jpg,http://images.autoexposure.co.uk/AETA27382/AETV60978280_6b.jpg,http://images.autoexposure.co.uk/AETA27382/AETV60978280_7b.jpg,http://images.autoexposure.co.uk/AETA27382/AETV60978280_8b.jpg,http://images.autoexposure.co.uk/AETA27382/AETV60978280_9b.jpg,http://images.autoexposure.co.uk/AETA27382/AETV60978280_10b.jpg","0","4","","0","Insurance Group 3, ABS, Alloy Wheels, Audio Remote Control, Body Coloured Bumpers, Climate Control, Drivers Airbag, Electric Door Mirrors, Folding Rear Seats, Front Electric Windows, Front Fog Lights, Heated Front Seat, Height Adjustable Drivers Seat, Immobiliser, Passenger Airbag, Power Steering, Radio/CD Multichanger, Remote Central Locking, Service Indicator, Side Airbags, Sports Seats, Steering Wheel Rake Adjustment, Telephone, Trip Computer","","0","1","","UK","0","","0","0","","","",""
"AETA27382","AETV61113074","BN56ZSR","WHITE","DIESEL","2006","222000","Panel Van","","NISSAN","PRIMASTAR","SE DCI 100 SWB","1870","2500","","Manual","http://images.autoexposure.co.uk/AETA27382/AETV61113074_1b.jpg,http://images.autoexposure.co.uk/AETA27382/AETV61113074_2b.jpg,http://images.autoexposure.co.uk/AETA27382/AETV61113074_3b.jpg,http://images.autoexposure.co.uk/AETA27382/AETV61113074_4b.jpg,http://images.autoexposure.co.uk/AETA27382/AETV61113074_5b.jpg,http://images.autoexposure.co.uk/AETA27382/AETV61113074_6b.jpg,http://images.autoexposure.co.uk/AETA27382/AETV61113074_7b.jpg,http://images.autoexposure.co.uk/AETA27382/AETV61113074_8b.jpg,http://images.autoexposure.co.uk/AETA27382/AETV61113074_9b.jpg","0","","","0","Central Locking, Electric Windows, Electric Mirrors, Power Steering, Drivers Airbag, Passenger Airbag, Ply Lined, Side ans Rear Loader, Bulkhead,CD Player, Radio, THIS IS A TRADE SALE!!!! PRICE DOES NOT INCLUDE VAT!!!, Price Plus VAT","","0","1","","UK","0","","0","0","","","",""
"AETA27382","AETV62318569","BJ10VOB","Cafe Latte","Petrol","2010","24700","Hatchback","5","NISSAN","QASHQAI","1.6 Visia","1598","10995","","Manual","http://images.autoexposure.co.uk/AETA27382/AETV62318569_1b.jpg,http://images.autoexposure.co.uk/AETA27382/AETV62318569_2b.jpg,http://images.autoexposure.co.uk/AETA27382/AETV62318569_3b.jpg,http://images.autoexposure.co.uk/AETA27382/AETV62318569_4b.jpg,http://images.autoexposure.co.uk/AETA27382/AETV62318569_5b.jpg,http://images.autoexposure.co.uk/AETA27382/AETV62318569_6b.jpg,http://images.autoexposure.co.uk/AETA27382/AETV62318569_7b.jpg,http://images.autoexposure.co.uk/AETA27382/AETV62318569_8b.jpg","0","","","0","ABS, Air Conditioning, Alloy Wheels, Audio Remote Control, Drivers Airbag, Electric Door Mirrors, Folding Rear Seats, Front Electric Windows, Heated Door Mirrors, Height Adjustable Drivers Seat, Immobiliser, Passenger Airbag, Power Steering, Radio/CD, Rear Electric Windows, Remote Central Locking, Service Indicator, Side Airbags, Steering Wheel Rake Adjustment, Steering Wheel Reach Adjustment, Traction Control, Trip Computer","","0","1","","UK","0","","0","0","","","",""
"AETA27382","AETV62698623","OU04LCX","Reflex Silver","Diesel","2004","72000","MPV","5","SEAT","ALHAMBRA","1.9 TDi PD SX 6 Seat","1896","4995","","Manual","http://images.autoexposure.co.uk/AETA27382/AETV62698623_1b.jpg,http://images.autoexposure.co.uk/AETA27382/AETV62698623_2b.jpg,http://images.autoexposure.co.uk/AETA27382/AETV62698623_3b.jpg,http://images.autoexposure.co.uk/AETA27382/AETV62698623_4b.jpg,http://images.autoexposure.co.uk/AETA27382/AETV62698623_5b.jpg,http://images.autoexposure.co.uk/AETA27382/AETV62698623_6b.jpg,http://images.autoexposure.co.uk/AETA27382/AETV62698623_7b.jpg,http://images.autoexposure.co.uk/AETA27382/AETV62698623_8b.jpg,http://images.autoexposure.co.uk/AETA27382/AETV62698623_9b.jpg","0","2","","0","Insurance Group 12, 2 Registered Keepers, ABS, Alarm, Body Coloured Bumpers, Climate Control, Cruise Control, Drivers Airbag, Electric Door Mirrors, Front Electric Windows, Heated Door Mirrors, Height Adjustable Drivers Seat, Immobiliser, Passenger Airbag, Power Steering, Radio/CD, Remote Central Locking, Roof Rails, Side Airbags, Steering Wheel Rake Adjustment, Steering Wheel Reach Adjustment","","0","1","","UK","0","","0","0","","","",""
"AETA27382","AETV62828497","T708MDX","BLUE","Petrol","1999","154000","Saloon","4","BMW","3 SERIES","318i SE","1895","895","","Manual","http://images.autoexposure.co.uk/AETA27382/AETV62828497_1b.jpg,http://images.autoexposure.co.uk/AETA27382/AETV62828497_2b.jpg,http://images.autoexposure.co.uk/AETA27382/AETV62828497_3b.jpg,http://images.autoexposure.co.uk/AETA27382/AETV62828497_4b.jpg,http://images.autoexposure.co.uk/AETA27382/AETV62828497_5b.jpg,http://images.autoexposure.co.uk/AETA27382/AETV62828497_6b.jpg","0","6","","0","Insurance Group 11, ABS, Alarm, Alloy Wheels, Body Coloured Bumpers, Drivers Airbag, Electric Door Mirrors, Electric Sunroof, Front Electric Windows, Front Fog Lights, Heated Door Mirrors, Height Adjustable Drivers Seat, Immobiliser, Passenger Airbag, Radio/Cassette, Service Indicator, Side Airbags, Steering Wheel Rake Adjustment, Steering Wheel Reach Adjustment, Traction Control. MOT UNTIL 28.01.2013!!, THIS IS A TRADE CAR.","","0","1","","UK","0","","0","0","895","ONO","",""
"AETA27382","AETV63191786","BD07ZGN","Zermatt Silver","Diesel","2007","46000","4x4","5","LAND ROVER","DISCOVERY","2.7 Td V6 XS Auto","2720","17995","","Auto","http://images.autoexposure.co.uk/AETA27382/AETV63191786_1b.jpg,http://images.autoexposure.co.uk/AETA27382/AETV63191786_2b.jpg,http://images.autoexposure.co.uk/AETA27382/AETV63191786_3b.jpg,http://images.autoexposure.co.uk/AETA27382/AETV63191786_4b.jpg,http://images.autoexposure.co.uk/AETA27382/AETV63191786_5b.jpg,http://images.autoexposure.co.uk/AETA27382/AETV63191786_6b.jpg,http://images.autoexposure.co.uk/AETA27382/AETV63191786_7b.jpg,http://images.autoexposure.co.uk/AETA27382/AETV63191786_8b.jpg,http://images.autoexposure.co.uk/AETA27382/AETV63191786_9b.jpg,http://images.autoexposure.co.uk/AETA27382/AETV63191786_10b.jpg","0","","","1","Insurance Group 13, ABS, Alarm, Alloy Wheels, Audio Remote Control, Climate Control, Cruise Control, Drivers Airbag, Electric Door Mirrors, Folding Rear Seats, Front Electric Windows, Front Fog Lights, Headlight Washers, Heated Door Mirrors, Height Adjustable Drivers Seat, Immobiliser, Passenger Airbag, Power Steering, Radio/CD Multichanger, Rear Electric Windows, Remote Central Locking, Reverse Parking Aid, Roof Rails, Service Indicator, Side Airbags, Steering Wheel Rake Adjustment, Steering Wheel Reach Adjustment, Traction Control, Trip Computer","","0","1","","UK","0","","0","0","","","",""
"AETA27382","AETV63362808","BJ55OER","BLACK","DIESEL","2005","117000","Pick Up","4","NISSAN","NAVARA","2.5 DCI DC Aventura Auto","2488","7750","","Auto","http://images.autoexposure.co.uk/AETA27382/AETV63362808_1b.jpg,http://images.autoexposure.co.uk/AETA27382/AETV63362808_2b.jpg,http://images.autoexposure.co.uk/AETA27382/AETV63362808_3b.jpg,http://images.autoexposure.co.uk/AETA27382/AETV63362808_4b.jpg,http://images.autoexposure.co.uk/AETA27382/AETV63362808_5b.jpg,http://images.autoexposure.co.uk/AETA27382/AETV63362808_6b.jpg,http://images.autoexposure.co.uk/AETA27382/AETV63362808_7b.jpg,http://images.autoexposure.co.uk/AETA27382/AETV63362808_8b.jpg,http://images.autoexposure.co.uk/AETA27382/AETV63362808_9b.jpg","0","","","0","Leather, Sat Nav, Rear Park Sensors, Alloys, Mudflaps, Roof Bars, , Central Locking, Electric Windows, Electric Mirrors, Air Conditioning, Climate Control, Power Steering, Drivers Airbag, Passenger Airbag, Alarm, CD, Fog Lamps, Electric Seats, Heated Front Seats, Sunroof. PRICE DOES NOT INCLUDE VAT!!!","","0","1","","UK","0","","0","0","","","",""
"AETA27382","AETV63530773","ET51WPJ","RED","DIESEL","2002","81000","Pick Up","2","NISSAN","CABSTAR","E95 SWB","2664","2500","","Manual","http://images.autoexposure.co.uk/AETA27382/AETV63530773_1b.jpg,http://images.autoexposure.co.uk/AETA27382/AETV63530773_2b.jpg,http://images.autoexposure.co.uk/AETA27382/AETV63530773_3b.jpg,http://images.autoexposure.co.uk/AETA27382/AETV63530773_4b.jpg,http://images.autoexposure.co.uk/AETA27382/AETV63530773_5b.jpg,http://images.autoexposure.co.uk/AETA27382/AETV63530773_6b.jpg","0","3","","0","MOT UNTIL 11/13. THIS IS A TRADE SALE!!! PRICE DOES NOT INCLUDE VAT!!!, , Central Locking, Power Steering, Drivers Airbag, Dual Passenger Seats, Stereo, CD Player, MOT UNTIL 03/11/13. THIS IS A TRADE SALE!!! PRICE DOES NOT INCLUDE VAT!!!","","0","1","","UK","0","","0","0","2500","+ VAT","",""
"AETA27382","AETV63942030","BN56ZPZ","Blade","Petrol","2006","26000","Hatchback","5","NISSAN","MICRA","1.2 Spirita","1240","4495","","Manual","http://images.autoexposure.co.uk/AETA27382/AETV63942030_1b.jpg,http://images.autoexposure.co.uk/AETA27382/AETV63942030_2b.jpg,http://images.autoexposure.co.uk/AETA27382/AETV63942030_3b.jpg,http://images.autoexposure.co.uk/AETA27382/AETV63942030_4b.jpg,http://images.autoexposure.co.uk/AETA27382/AETV63942030_5b.jpg,http://images.autoexposure.co.uk/AETA27382/AETV63942030_6b.jpg,http://images.autoexposure.co.uk/AETA27382/AETV63942030_7b.jpg,http://images.autoexposure.co.uk/AETA27382/AETV63942030_8b.jpg,http://images.autoexposure.co.uk/AETA27382/AETV63942030_9b.jpg,http://images.autoexposure.co.uk/AETA27382/AETV63942030_10b.jpg","0","2","","0","Insurance Group 2, 2 Registered Keepers, ABS, Air Conditioning, Audio Remote Control, Body Coloured Bumpers, Drivers Airbag, Electric Door Mirrors, Folding Rear Seats, Front Electric Windows, Height Adjustable Drivers Seat, Immobiliser, Passenger Airbag, Power Steering, Radio/CD, Remote Central Locking, Service Indicator, Side Airbags, Steering Wheel Rake Adjustment, Trip Computer","","0","1","","UK","0","","0","0","","","",""
"AETA27382","AETV64296172","BN53MLJ","MAUVE","Petrol","2003","73000","MPV","5","CITROEN","XSARA PICASSO","1.6i Desire 2","1587","3495","","Manual","http://images.autoexposure.co.uk/AETA27382/AETV64296172_1b.jpg,http://images.autoexposure.co.uk/AETA27382/AETV64296172_2b.jpg,http://images.autoexposure.co.uk/AETA27382/AETV64296172_3b.jpg,http://images.autoexposure.co.uk/AETA27382/AETV64296172_4b.jpg,http://images.autoexposure.co.uk/AETA27382/AETV64296172_5b.jpg,http://images.autoexposure.co.uk/AETA27382/AETV64296172_6b.jpg,http://images.autoexposure.co.uk/AETA27382/AETV64296172_7b.jpg","0","4","","0","Insurance Group 5, ABS, Audio Remote Control, Body Coloured Bumpers, Drivers Airbag, Electric Door Mirrors, Folding Rear Seats, Front Electric Windows, Heated Door Mirrors, Height Adjustable Drivers Seat, Immobiliser, Passenger Airbag, Power Steering, Radio/CD, Remote Central Locking, Service Indicator, Side Airbags, Steering Wheel Rake Adjustment, Trip Computer","","0","1","","UK","0","","0","0","","","",""
"AETA27382","AETV64697732","EA07WME","Titanium silver","Petrol","2007","55000","Hatchback","5","BMW","1 SERIES","116i SE","1596","7495","","Manual","http://images.autoexposure.co.uk/AETA27382/AETV64697732_1b.jpg,http://images.autoexposure.co.uk/AETA27382/AETV64697732_2b.jpg,http://images.autoexposure.co.uk/AETA27382/AETV64697732_3b.jpg,http://images.autoexposure.co.uk/AETA27382/AETV64697732_4b.jpg,http://images.autoexposure.co.uk/AETA27382/AETV64697732_5b.jpg,http://images.autoexposure.co.uk/AETA27382/AETV64697732_6b.jpg,http://images.autoexposure.co.uk/AETA27382/AETV64697732_7b.jpg,http://images.autoexposure.co.uk/AETA27382/AETV64697732_8b.jpg,http://images.autoexposure.co.uk/AETA27382/AETV64697732_9b.jpg,http://images.autoexposure.co.uk/AETA27382/AETV64697732_10b.jpg","0","2","","0","Insurance Group 10, 2 Registered Keepers, ABS, Air Conditioning, Alarm, Alloy Wheels, Audio Remote Control, Body Coloured Bumpers, Drivers Airbag, Electric Door Mirrors, Folding Rear Seats, Front Electric Windows, Front Fog Lights, Heated Door Mirrors, Height Adjustable Drivers Seat, Immobiliser, Passenger Airbag, Power Steering, Radio/CD, Rear Electric Windows, Remote Central Locking, Reverse Parking Aid, Service Indicator, Side Airbags, Steering Wheel Rake Adjustment, Steering Wheel Reach Adjustment, Traction Control, Trip Computer","","0","1","","UK","0","","0","0","","","",""
"AETA27382","AETV65232245","BK60KEJ","Onyx black","Petrol","2010","14300","Cabriolet","2","PEUGEOT","207","1.6 VTi GT","1598","9995","","Manual","http://images.autoexposure.co.uk/AETA27382/AETV65232245_1b.jpg,http://images.autoexposure.co.uk/AETA27382/AETV65232245_2b.jpg,http://images.autoexposure.co.uk/AETA27382/AETV65232245_3b.jpg,http://images.autoexposure.co.uk/AETA27382/AETV65232245_4b.jpg,http://images.autoexposure.co.uk/AETA27382/AETV65232245_5b.jpg,http://images.autoexposure.co.uk/AETA27382/AETV65232245_6b.jpg,http://images.autoexposure.co.uk/AETA27382/AETV65232245_7b.jpg,http://images.autoexposure.co.uk/AETA27382/AETV65232245_8b.jpg","0","","","0","Insurance Group 9, ABS, Alarm, Alloy Wheels, Audio Remote Control, Climate Control, Cruise Control, Drivers Airbag, Electric Door Mirrors, Front Electric Windows, Front Fog Lights, Heated Door Mirrors, Height Adjustable Drivers Seat, Immobiliser, Passenger Airbag, Power Steering, Radio/CD, Rear Electric Windows, Remote Central Locking, Reverse Parking Aid, Service Indicator, Side Airbags, Sports Seats, Steering Wheel Rake Adjustment, Steering Wheel Reach Adjustment, Trip Computer","","0","1","","UK","0","","0","0","","","",""
"AETA27382","AETV66104725","BK55TZV","SILVER","Petrol","2005","71000","MPV","5","CITROEN","XSARA PICASSO","1.6i LX","1587","2995","","Manual","http://images.autoexposure.co.uk/AETA27382/AETV66104725_1b.jpg,http://images.autoexposure.co.uk/AETA27382/AETV66104725_2b.jpg,http://images.autoexposure.co.uk/AETA27382/AETV66104725_3b.jpg,http://images.autoexposure.co.uk/AETA27382/AETV66104725_4b.jpg,http://images.autoexposure.co.uk/AETA27382/AETV66104725_5b.jpg,http://images.autoexposure.co.uk/AETA27382/AETV66104725_6b.jpg,http://images.autoexposure.co.uk/AETA27382/AETV66104725_7b.jpg,http://images.autoexposure.co.uk/AETA27382/AETV66104725_8b.jpg,http://images.autoexposure.co.uk/AETA27382/AETV66104725_9b.jpg,http://images.autoexposure.co.uk/AETA27382/AETV66104725_10b.jpg","0","4","","0","Insurance Group 5, ABS, Audio Remote Control, Body Coloured Bumpers, Drivers Airbag, Electric Door Mirrors, Folding Rear Seats, Front Electric Windows, Heated Door Mirrors, Height Adjustable Drivers Seat, Immobiliser, Passenger Airbag, Power Steering, Radio/CD, Remote Central Locking, Service Indicator, Side Airbags, Steering Wheel Rake Adjustment, Trip Computer","","0","1","","UK","0","","0","0","","","",""
"AETA27382","AETV66386408","CU05UMK","SILVER","Petrol","2005","53000","Saloon","4","ROVER","75","2.5 V6 Connoisseur SE","2497","2995","","Manual","http://images.autoexposure.co.uk/AETA27382/AETV66386408_1b.jpg,http://images.autoexposure.co.uk/AETA27382/AETV66386408_2b.jpg,http://images.autoexposure.co.uk/AETA27382/AETV66386408_3b.jpg,http://images.autoexposure.co.uk/AETA27382/AETV66386408_4b.jpg,http://images.autoexposure.co.uk/AETA27382/AETV66386408_5b.jpg,http://images.autoexposure.co.uk/AETA27382/AETV66386408_6b.jpg,http://images.autoexposure.co.uk/AETA27382/AETV66386408_7b.jpg,http://images.autoexposure.co.uk/AETA27382/AETV66386408_8b.jpg,http://images.autoexposure.co.uk/AETA27382/AETV66386408_9b.jpg,http://images.autoexposure.co.uk/AETA27382/AETV66386408_10b.jpg","0","2","","0","Insurance Group 14, 2 Registered Keepers, ABS, Air Conditioning, Alarm, Alloy Wheels, Audio Remote Control, Body Coloured Bumpers, Central Locking, Climate Control, Drivers Airbag, Electric Door Mirrors, Electrically Adjustable Drivers Seat, Electrically Adjustable Passenger Seat, Folding Rear Seats, Front Electric Windows, Front Fog Lights, Heated Door Mirrors, Heated Front Seat, Height Adjustable Drivers Seat, Immobiliser, Leather Seats, Passenger Airbag, Power Steering, Radio/Cassette, Rear Electric Windows, Remote Central Locking, Reverse Parking Aid, Satellite Navigation, Service Indicator, Side Airbags, Steering Wheel Rake Adjustment, Steering Wheel Reach Adjustment","","0","1","","UK","0","","0","0","","","",""
"AETA27382","AETV66803277","FL58XTB","Tyrol silver","Petrol","2008","29000","4x4","5","LEXUS","RX","350 3.5 SE-L Auto","3456","16495","","Auto","http://images.autoexposure.co.uk/AETA27382/AETV66803277_1b.jpg,http://images.autoexposure.co.uk/AETA27382/AETV66803277_2b.jpg,http://images.autoexposure.co.uk/AETA27382/AETV66803277_3b.jpg,http://images.autoexposure.co.uk/AETA27382/AETV66803277_4b.jpg,http://images.autoexposure.co.uk/AETA27382/AETV66803277_5b.jpg,http://images.autoexposure.co.uk/AETA27382/AETV66803277_6b.jpg,http://images.autoexposure.co.uk/AETA27382/AETV66803277_7b.jpg,http://images.autoexposure.co.uk/AETA27382/AETV66803277_8b.jpg,http://images.autoexposure.co.uk/AETA27382/AETV66803277_9b.jpg,http://images.autoexposure.co.uk/AETA27382/AETV66803277_10b.jpg","0","2","","1","Insurance Group 17, 2 Registered Keepers, ABS, Alarm, Alloy Wheels, Audio Remote Control, Body Coloured Bumpers, Climate Control, Cruise Control, Drivers Airbag, DVD, Electric Door Mirrors, Electric Sunroof, Electrically Adjustable Drivers Seat, Electrically Adjustable Passenger Seat, Folding Rear Seats, Front Electric Windows, Front Fog Lights, Headlight Washers, Heated Door Mirrors, Heated Front Seat, Height Adjustable Drivers Seat, Immobiliser, Leather Seats, Passenger Airbag, Power Steering, Radio/CD Multichanger, Rear Electric Windows, Remote Central Locking, Reverse Parking Aid, Roof Rails, Satellite Navigation, Side Airbags, Steering Wheel Rake Adjustment, Steering Wheel Reach Adjustment, Traction Control, Trip Computer","","0","1","","UK","0","","0","0","","","",""
"AETA27382","AETV67628663","VN12BNB","Sky blue","Electric","2012","2200","Hatchback","5","NISSAN","LEAF","5dr Auto","","21495","","Auto","http://images.autoexposure.co.uk/AETA27382/AETV67628663_1b.jpg,http://images.autoexposure.co.uk/AETA27382/AETV67628663_2b.jpg,http://images.autoexposure.co.uk/AETA27382/AETV67628663_3b.jpg,http://images.autoexposure.co.uk/AETA27382/AETV67628663_4b.jpg,http://images.autoexposure.co.uk/AETA27382/AETV67628663_5b.jpg,http://images.autoexposure.co.uk/AETA27382/AETV67628663_6b.jpg,http://images.autoexposure.co.uk/AETA27382/AETV67628663_7b.jpg,http://images.autoexposure.co.uk/AETA27382/AETV67628663_8b.jpg","0","","","0","ABS, Alloy Wheels, Audio Remote Control, Body Coloured Bumpers, Climate Control, Cruise Control, Drivers Airbag, Electric Door Mirrors, Front Electric Windows, Passenger Airbag, Power Steering, Radio/CD, Rear Electric Windows, Remote Central Locking, Reverse Parking Aid, Satellite Navigation, Side Airbags, Traction Control, Trip Computer","","0","1","","UK","0","","0","0","","","",""
"AETA27382","AETV67821846","BL54BZE","BLUE","Petrol","2005","92000","Hatchback","3","RENAULT","CLIO","1.2 16V Dynamique","1149","2995","","Manual","http://images.autoexposure.co.uk/AETA27382/AETV67821846_1b.jpg,http://images.autoexposure.co.uk/AETA27382/AETV67821846_2b.jpg,http://images.autoexposure.co.uk/AETA27382/AETV67821846_3b.jpg,http://images.autoexposure.co.uk/AETA27382/AETV67821846_4b.jpg,http://images.autoexposure.co.uk/AETA27382/AETV67821846_5b.jpg,http://images.autoexposure.co.uk/AETA27382/AETV67821846_6b.jpg","0","3","","0","Insurance Group 3, ABS, Alloy Wheels, Audio Remote Control, Body Coloured Bumpers, Drivers Airbag, Electric Door Mirrors, Folding Rear Seats, Front Electric Windows, Front Fog Lights, Heated Door Mirrors, Height Adjustable Drivers Seat, Immobiliser, Passenger Airbag, Power Steering, Radio/CD, Remote Central Locking, Side Airbags, Sports Seats, Steering Wheel Rake Adjustment, Sunroof, Trip Computer","","0","1","","UK","0","","0","0","","","",""
"AETA27382","AETV68331419","L987YNX","SILVER","PETROL","1993","71000","Saloon","4","VAUXHALL","CAVALIER","LS AUTO 2.0","1998","495","","Auto","http://images.autoexposure.co.uk/AETA27382/AETV68331419_1b.jpg,http://images.autoexposure.co.uk/AETA27382/AETV68331419_2b.jpg,http://images.autoexposure.co.uk/AETA27382/AETV68331419_3b.jpg,http://images.autoexposure.co.uk/AETA27382/AETV68331419_4b.jpg,http://images.autoexposure.co.uk/AETA27382/AETV68331419_5b.jpg,http://images.autoexposure.co.uk/AETA27382/AETV68331419_6b.jpg,http://images.autoexposure.co.uk/AETA27382/AETV68331419_7b.jpg,http://images.autoexposure.co.uk/AETA27382/AETV68331419_8b.jpg,http://images.autoexposure.co.uk/AETA27382/AETV68331419_9b.jpg,http://images.autoexposure.co.uk/AETA27382/AETV68331419_10b.jpg","0","","","0","Central Locking, Electric Windows, Sunroof, Power Steering, Drivers Airbag, Passenger Airbag, Mudflaps, CD Player, THIS IS A TRADE SALE!!!","","0","1","","UK","0","","0","0","495","","",""
"AETA27382","AETV68570538","BK61ZFF","RED","Petrol","2011","9500","MPV","5","NISSAN","NOTE","1.6 N-Tec","1598","9995","","Manual","http://images.autoexposure.co.uk/AETA27382/AETV68570538_1b.jpg,http://images.autoexposure.co.uk/AETA27382/AETV68570538_2b.jpg,http://images.autoexposure.co.uk/AETA27382/AETV68570538_3b.jpg,http://images.autoexposure.co.uk/AETA27382/AETV68570538_4b.jpg,http://images.autoexposure.co.uk/AETA27382/AETV68570538_5b.jpg,http://images.autoexposure.co.uk/AETA27382/AETV68570538_6b.jpg,http://images.autoexposure.co.uk/AETA27382/AETV68570538_7b.jpg,http://images.autoexposure.co.uk/AETA27382/AETV68570538_8b.jpg","0","","","0","Insurance Group 6, ABS, Alloy Wheels, Audio Remote Control, Body Coloured Bumpers, Climate Control, Cruise Control, Drivers Airbag, Electric Door Mirrors, Folding Rear Seats, Front Electric Windows, Front Fog Lights, Heated Door Mirrors, Height Adjustable Drivers Seat, Immobiliser, Passenger Airbag, Power Steering, Radio/CD, Rear Electric Windows, Remote Central Locking, Satellite Navigation, Service Indicator, Side Airbags, Steering Wheel Rake Adjustment, Trip Computer","","0","1","","UK","0","","0","0","","","",""
"AETA27382","AETV68682108","BT12TGO","Shell white","Petrol","2012","50","Hatchback","5","NISSAN","PIXO","1.0 N-Tec","996","8165","","Manual","http://images.autoexposure.co.uk/AETA27382/AETV68682108_1b.jpg,http://images.autoexposure.co.uk/AETA27382/AETV68682108_2b.jpg,http://images.autoexposure.co.uk/AETA27382/AETV68682108_3b.jpg,http://images.autoexposure.co.uk/AETA27382/AETV68682108_4b.jpg,http://images.autoexposure.co.uk/AETA27382/AETV68682108_5b.jpg,http://images.autoexposure.co.uk/AETA27382/AETV68682108_6b.jpg","0","","","0","Insurance Group 2, ABS, Air Conditioning, Alloy Wheels, Drivers Airbag, Folding Rear Seats, Front Electric Windows, Front Fog Lights, Height Adjustable Drivers Seat, Immobiliser, Passenger Airbag, Power Steering, Radio/CD, Remote Central Locking, Side Airbags, Steering Wheel Rake Adjustment. CASH BACK OFFER ON THIS VEHICLE. CALL OUR SALES CENTRE ON 01827 895125 FOR MORE DETAILS!!","","0","1","","UK","0","","0","0","","","",""
